{
  "$schema": "./agent-multiturn-50.schema.json",
  "version": 1,
  "description": "基于当前激活 Ragpack 的 50 组真实多轮端到端评测。黄金集只用于评分，不得反哺路由或检索规则。",
  "dataSnapshot": {
    "papers": 3327,
    "patents": 23066,
    "mentors": 16126,
    "projects": 0,
    "paperDocuments": 26393,
    "graphEntities": 374224,
    "graphEdges": 539921,
    "ragpackImportedAt": "2026-06-25T05:48:31.890Z",
    "fingerprint": "ragpack-v1-20260625-p3327-x23066-m16126-e374224-r539921"
  },
  "scenarios": [
    {
      "id": "M01",
      "category": "mentor-institution",
      "description": "高校简称导师名单与方向追问",
      "turns": [
        {
          "question": "清华有那些电气方向的老师？",
          "expectedIntent": "mentor",
          "requiredTools": ["search.horizontal"],
          "forbiddenTools": ["analytics.group_by"],
          "requiredSourceTypes": ["mentor"],
          "mustContain": ["清华大学"],
          "minSources": 1,
          "maxToolCalls": 4
        },
        {
          "question": "其中研究储能或电力系统的有哪些？",
          "expectedIntent": "mentor",
          "requiredTools": ["search.horizontal"],
          "requiredSourceTypes": ["mentor"],
          "mustContainAny": [["储能", "电力系统"], ["清华"]],
          "expectedTopicShift": false,
          "minSources": 1,
          "maxToolCalls": 4
        }
      ]
    },
    {
      "id": "M02",
      "category": "mentor-institution",
      "description": "上海交大导师名单与联系方式",
      "turns": [
        {
          "question": "上海交通大学电气工程学院有哪些电力电子方向导师？",
          "expectedIntent": "mentor",
          "requiredTools": ["search.horizontal"],
          "requiredSourceTypes": ["mentor"],
          "mustContain": ["上海交通大学"],
          "minSources": 1,
          "maxToolCalls": 4
        },
        {
          "question": "请给出刚才名单中能确认的邮箱，不能确认的不要猜。",
          "expectedIntent": "mentor",
          "requiredSourceTypes": ["mentor"],
          "mustContainAny": [["@", "邮箱"], ["无法确认", "未提供"]],
          "expectedTopicShift": false,
          "minSources": 1,
          "maxToolCalls": 4
        }
      ]
    },
    {
      "id": "M03",
      "category": "mentor-institution",
      "description": "华北电力大学导师筛选",
      "turns": [
        {
          "question": "华电有哪些研究电力系统的导师？",
          "expectedIntent": "mentor",
          "requiredTools": ["search.horizontal"],
          "requiredSourceTypes": ["mentor"],
          "mustContain": ["华北电力大学"],
          "minSources": 1,
          "maxToolCalls": 4
        },
        {
          "question": "他们中有明确研究虚拟电厂的吗？",
          "expectedIntent": "mentor",
          "requiredTools": ["search.horizontal"],
          "requiredSourceTypes": ["mentor"],
          "mustContainAny": [["虚拟电厂"], ["没有", "未确认", "无可靠"]],
          "expectedTopicShift": false,
          "maxToolCalls": 4
        }
      ]
    },
    {
      "id": "M04",
      "category": "mentor-institution",
      "description": "人工智能与电力系统方向导师",
      "turns": [
        {
          "question": "哪些导师的档案明确提到人工智能与电力系统？",
          "expectedIntent": "mentor",
          "requiredTools": ["search.horizontal"],
          "requiredSourceTypes": ["mentor"],
          "mustContainAny": [["李广地", "周博文", "江艺宝", "万灿"], ["人工智能", "电力系统"]],
          "minSources": 1,
          "maxToolCalls": 4
        },
        {
          "question": "把姓名和学校对应列出来。",
          "expectedIntent": "mentor",
          "requiredSourceTypes": ["mentor"],
          "mustContainAny": [["东北大学", "山东大学", "浙江大学"]],
          "expectedTopicShift": false,
          "minSources": 1,
          "maxToolCalls": 4
        }
      ]
    },
    {
      "id": "M05",
      "category": "mentor-institution",
      "description": "宽禁带与功率器件导师",
      "turns": [
        {
          "question": "库里有哪些研究宽禁带器件、SiC 或功率半导体的导师？",
          "expectedIntent": "mentor",
          "requiredTools": ["search.horizontal"],
          "requiredSourceTypes": ["mentor"],
          "mustContainAny": [["SiC", "碳化硅", "宽禁带", "功率半导体"]],
          "minSources": 1,
          "maxToolCalls": 4
        },
        {
          "question": "只保留导师档案直接支持的方向，不要把论文作者都算成导师。",
          "expectedIntent": "mentor",
          "requiredSourceTypes": ["mentor"],
          "mustNotContain": ["论文作者都属于导师"],
          "expectedTopicShift": false,
          "minSources": 1,
          "maxToolCalls": 4
        }
      ]
    },
    {
      "id": "M06",
      "category": "mentor-institution",
      "description": "虚拟电厂导师及特定人物追问",
      "turns": [
        {
          "question": "有没有研究虚拟电厂的导师？请列姓名和学校。",
          "expectedIntent": "mentor",
          "requiredTools": ["search.horizontal"],
          "requiredSourceTypes": ["mentor"],
          "mustContainAny": [["刘佩", "张放", "陈奇芳", "苏粟"], ["虚拟电厂"]],
          "minSources": 1,
          "maxToolCalls": 4
        },
        {
          "question": "陈奇芳老师的档案能确认哪些研究方向？",
          "expectedIntent": "person",
          "requiredTools": ["domain.persons.resolve"],
          "requiredSourceTypes": ["mentor"],
          "mustContain": ["陈奇芳"],
          "expectedResolvedPerson": "陈奇芳",
          "minSources": 1,
          "maxToolCalls": 4
        }
      ]
    },
    {
      "id": "M07",
      "category": "mentor-institution",
      "description": "学生信息与导师边界",
      "turns": [
        {
          "question": "有哪些明确写着硕士研究生身份且研究电力系统的学生记录？",
          "expectedIntent": "student",
          "requiredTools": ["search.horizontal"],
          "requiredSourceTypes": ["paper"],
          "mustContainAny": [["硕士研究生", "硕士生"], ["学生"]],
          "mustNotContain": ["以下导师"],
          "minSources": 1,
          "maxToolCalls": 4
        },
        {
          "question": "这些结果能当作完整学生名单吗？为什么？",
          "expectedIntent": "student",
          "mustContainAny": [["不能", "不完整", "仅能"], ["正文", "作者简介", "非结构化"]],
          "expectedTopicShift": false,
          "maxToolCalls": 4
        }
      ]
    },
    {
      "id": "P01",
      "category": "paper-deep-read",
      "description": "精确论文定位与机理深读",
      "turns": [
        {
          "question": "请找到《匹配控制构网型直驱风电场经 LCC-HVDC 送出系统的次同步振荡特性及机理分析》。",
          "expectedIntent": "paper",
          "requiredTools": ["search.horizontal"],
          "requiredSourceTypes": ["paper"],
          "mustContainAny": [["匹配控制", "LCC-HVDC"], ["高本锋"]],
          "minSources": 1,
          "maxToolCalls": 4
        },
        {
          "question": "这篇论文如何描述次同步振荡的主要特征和机理？",
          "expectedIntent": "paper",
          "requiredTools": ["read"],
          "requiredSourceTypes": ["paper"],
          "mustContainAny": [["次同步振荡", "振荡"], ["机理", "匹配控制"]],
          "expectedFocusPaperContains": "匹配控制构网型直驱风电场",
          "expectedTopicShift": false,
          "minSources": 1,
          "maxToolCalls": 4
        }
      ]
    },
    {
      "id": "P02",
      "category": "paper-deep-read",
      "description": "SiC 论文检索与分类",
      "turns": [
        {
          "question": "库里有哪些与 SiC MOSFET 或 Si/SiC 混合器件直接相关的论文？",
          "expectedIntent": "paper",
          "requiredTools": ["search.horizontal"],
          "requiredSourceTypes": ["paper"],
          "mustContainAny": [["SiC", "碳化硅"], ["MOSFET", "混合器件"]],
          "minSources": 2,
          "maxToolCalls": 4
        },
        {
          "question": "按驱动保护、热管理和模块三个方向归类，资料不足的类别明确说不足。",
          "expectedIntent": "list",
          "requiredSourceTypes": ["paper"],
          "mustContainAny": [["驱动", "保护"], ["热", "温度"], ["模块", "资料不足"]],
          "expectedTopicShift": false,
          "minSources": 1,
          "maxToolCalls": 4
        }
      ]
    },
    {
      "id": "P03",
      "category": "paper-deep-read",
      "description": "DAB 论文与控制目标",
      "turns": [
        {
          "question": "查找高频 DAB 变换器相关论文。",
          "expectedIntent": "paper",
          "requiredTools": ["search.horizontal"],
          "requiredSourceTypes": ["paper"],
          "mustContain": ["DAB"],
          "minSources": 1,
          "maxToolCalls": 4
        },
        {
          "question": "重点介绍龚邻骁那篇，它讨论哪类移相控制和优化目标？",
          "expectedIntent": "person",
          "requiredTools": ["domain.persons.resolve"],
          "requiredSourceTypes": ["paper"],
          "mustContainAny": [["龚邻骁"], ["移相", "优化"]],
          "expectedResolvedPerson": "龚邻骁",
          "minSources": 1,
          "maxToolCalls": 4
        }
      ]
    },
    {
      "id": "P04",
      "category": "paper-deep-read",
      "description": "虚拟电厂成果分类与具体论文",
      "turns": [
        {
          "question": "虚拟电厂相关论文有哪些？按调度优化、市场交易、数字孪生分类。",
          "expectedIntent": "paper",
          "requiredTools": ["search.horizontal"],
          "requiredSourceTypes": ["paper"],
          "mustContain": ["虚拟电厂"],
          "mustContainAny": [["调度", "优化"], ["市场", "交易"], ["数字孪生"]],
          "minSources": 2,
          "maxToolCalls": 4
        },
        {
          "question": "超大型城市虚拟电厂的数字孪生那篇主要讲什么？",
          "expectedIntent": "paper",
          "requiredTools": ["read"],
          "requiredSourceTypes": ["paper"],
          "mustContainAny": [["数字孪生"], ["超大型城市", "周翔"]],
          "expectedTopicShift": false,
          "minSources": 1,
          "maxToolCalls": 4
        }
      ]
    },
    {
      "id": "P05",
      "category": "paper-deep-read",
      "description": "MMC 论文与故障问题筛选",
      "turns": [
        {
          "question": "请查找 MMC 或柔性直流相关论文。",
          "expectedIntent": "paper",
          "requiredTools": ["search.horizontal"],
          "requiredSourceTypes": ["paper"],
          "mustContainAny": [["MMC", "柔性直流"]],
          "minSources": 2,
          "maxToolCalls": 4
        },
        {
          "question": "其中哪些直接讨论直流故障、过欠电压或保护？",
          "expectedIntent": "paper",
          "requiredTools": ["search.horizontal"],
          "requiredSourceTypes": ["paper"],
          "mustContainAny": [["故障", "保护", "过电压", "欠电压"]],
          "expectedTopicShift": false,
          "minSources": 1,
          "maxToolCalls": 4
        }
      ]
    },
    {
      "id": "P06",
      "category": "paper-deep-read",
      "description": "跟网与构网对比",
      "turns": [
        {